{
  "generated_at": "2026-05-11T20:09:53Z",
  "targets": {
    "pids": [
      "3412",
      "3688",
      "3744",
      "3900",
      "3980",
      "3120",
      "4"
    ],
    "paths": [
      "C:\\Users\\john.doe\\AppData\\Roaming\\a3f8c21d.exe",
      "C:\\Users\\john.doe\\AppData\\Local\\Temp\\svcupd.exe"
    ]
  },
  "by_pid": {
    "3412": {
      "handles.txt": [
        "L42958: 2068\tmfeann.exe\t0xc08eb01cd700\t0x650\tThread\t0x1fffff\tTid 3412 Pid 2068"
      ]
    },
    "3688": {},
    "3744": {
      "handles.txt": [
        "L43371: 3456\tWmiPrvSE.exe\t0xc08eb0374700\t0x208\tThread\t0x1fffff\tTid 3744 Pid 3456",
        "L43471: 3456\tWmiPrvSE.exe\t0xc08eb0374700\t0x3b0\tThread\t0x1fffff\tTid 3744 Pid 3456"
      ]
    },
    "3900": {
      "handles.txt": [
        "L22960: 2604\tSysmon64.exe\t0xc08eab49a700\t0x424\tThread\t0x1fffff\tTid 3900 Pid 2604"
      ]
    },
    "3980": {},
    "3120": {
      "handles.txt": [
        "L9916: 996\tsvchost.exe\t0xc08eae594400\t0xdcc\tThread\t0x1fffff\tTid 3120 Pid 996"
      ]
    },
    "4": {
      "cmdline.txt": [
        "L5: 4\tSystem\t-",
        "L8: 552\tcsrss.exe\t%SystemRoot%\\system32\\csrss.exe ObjectDirectory=\\Windows SharedSection=1024,20480,768 Windows=On SubSystemType=Windows ServerDll=basesrv,1 ServerDll=winsrv:UserServerDllInitialization,3 ServerDll=sxssrv,4 ProfileControl=Off MaxRequestThreads=16",
        "L11: 652\tcsrss.exe\t%SystemRoot%\\system32\\csrss.exe ObjectDirectory=\\Windows SharedSection=1024,20480,768 Windows=On SubSystemType=Windows ServerDll=basesrv,1 ServerDll=winsrv:UserServerDllInitialization,3 ServerDll=sxssrv,4 ProfileControl=Off MaxRequestThreads=16"
      ],
      "privileges.txt": [
        "L5: 4\tSystem\t2\tSeCreateTokenPrivilege\tPresent\tCreate a token object",
        "L6: 4\tSystem\t3\tSeAssignPrimaryTokenPrivilege\tPresent\tReplace a process-level token",
        "L7: 4\tSystem\t4\tSeLockMemoryPrivilege\tPresent,Enabled,Default\tLock pages in memory",
        "L8: 4\tSystem\t5\tSeIncreaseQuotaPrivilege\tPresent\tIncrease quotas",
        "L9: 4\tSystem\t6\tSeMachineAccountPrivilege\t\tAdd workstations to the domain",
        "L10: 4\tSystem\t7\tSeTcbPrivilege\tPresent,Enabled,Default\tAct as part of the operating system",
        "L11: 4\tSystem\t8\tSeSecurityPrivilege\tPresent\tManage auditing and security log",
        "L12: 4\tSystem\t9\tSeTakeOwnershipPrivilege\tPresent\tTake ownership of files/objects",
        "L13: 4\tSystem\t10\tSeLoadDriverPrivilege\tPresent\tLoad and unload device drivers",
        "L14: 4\tSystem\t11\tSeSystemProfilePrivilege\tPresent,Enabled,Default\tProfile system performance",
        "L15: 4\tSystem\t12\tSeSystemtimePrivilege\tPresent\tChange the system time",
        "L16: 4\tSystem\t13\tSeProfileSingleProcessPrivilege\tPresent,Enabled,Default\tProfile a single process",
        "L17: 4\tSystem\t14\tSeIncreaseBasePriorityPrivilege\tPresent,Enabled,Default\tIncrease scheduling priority",
        "L18: 4\tSystem\t15\tSeCreatePagefilePrivilege\tPresent,Enabled,Default\tCreate a pagefile",
        "L19: 4\tSystem\t16\tSeCreatePermanentPrivilege\tPresent,Enabled,Default\tCreate permanent shared objects",
        "L20: 4\tSystem\t17\tSeBackupPrivilege\tPresent\tBackup files and directories",
        "L21: 4\tSystem\t18\tSeRestorePrivilege\tPresent\tRestore files and directories",
        "L22: 4\tSystem\t19\tSeShutdownPrivilege\tPresent\tShut down the system",
        "L23: 4\tSystem\t20\tSeDebugPrivilege\tPresent,Enabled,Default\tDebug programs",
        "L24: 4\tSystem\t21\tSeAuditPrivilege\tPresent,Enabled,Default\tGenerate security audits",
        "L25: 4\tSystem\t22\tSeSystemEnvironmentPrivilege\tPresent\tEdit firmware environment values",
        "L26: 4\tSystem\t23\tSeChangeNotifyPrivilege\tPresent,Enabled,Default\tReceive notifications of changes to files or directories",
        "L27: 4\tSystem\t24\tSeRemoteShutdownPrivilege\t\tForce shutdown from a remote system",
        "L28: 4\tSystem\t25\tSeUndockPrivilege\tPresent\tRemove computer from docking station",
        "L29: 4\tSystem\t26\tSeSyncAgentPrivilege\t\tSynch directory service data",
        "L30: 4\tSystem\t27\tSeEnableDelegationPrivilege\t\tEnable user accounts to be trusted for delegation",
        "L31: 4\tSystem\t28\tSeManageVolumePrivilege\tPresent\tManage the files on a volume",
        "L32: 4\tSystem\t29\tSeImpersonatePrivilege\tPresent,Enabled,Default\tImpersonate a client after authentication",
        "L33: 4\tSystem\t30\tSeCreateGlobalPrivilege\tPresent,Enabled,Default\tCreate global objects",
        "L34: 4\tSystem\t31\tSeTrustedCredManAccessPrivilege\tPresent\tAccess Credential Manager as a trusted caller",
        "L35: 4\tSystem\t32\tSeRelabelPrivilege\tPresent\tModify the mandatory integrity level of an object",
        "L36: 4\tSystem\t33\tSeIncreaseWorkingSetPrivilege\tPresent,Enabled,Default\tAllocate more memory for user applications",
        "L37: 4\tSystem\t34\tSeTimeZonePrivilege\tPresent,Enabled,Default\tAdjust the time zone of the computer's internal clock",
        "L38: 4\tSystem\t35\tSeCreateSymbolicLinkPrivilege\tPresent,Enabled,Default\tRequired to create a symbolic link",
        "L39: 4\tSystem\t36\tSeDelegateSessionUserImpersonatePrivilege\tPresent,Enabled,Default\tObtain an impersonation token for another user in the same session.",
        "L42: 392\tsmss.exe\t4\tSeLockMemoryPrivilege\tPresent,Enabled,Default\tLock pages in memory",
        "L77: 540\tsmss.exe\t4\tSeLockMemoryPrivilege\tPresent,Enabled,Default\tLock pages in memory",
        "L112: 552\tcsrss.exe\t4\tSeLockMemoryPrivilege\tPresent,Enabled,Default\tLock pages in memory",
        "L147: 636\tsmss.exe\t4\tSeLockMemoryPrivilege\tPresent,Enabled,Default\tLock pages in memory",
        "L182: 644\twininit.exe\t4\tSeLockMemoryPrivilege\tDefault\tLock pages in memory",
        "L217: 652\tcsrss.exe\t4\tSeLockMemoryPrivilege\tPresent,Enabled,Default\tLock pages in memory",
        "L252: 740\twinlogon.exe\t4\tSeLockMemoryPrivilege\tDefault\tLock pages in memory",
        "L287: 776\tservices.exe\t4\tSeLockMemoryPrivilege\tPresent,Enabled,Default\tLock pages in memory",
        "L322: 788\tlsass.exe\t4\tSeLockMemoryPrivilege\tPresent,Enabled,Default\tLock pages in memory",
        "L357: 876\tsvchost.exe\t4\tSeLockMemoryPrivilege\tPresent,Enabled,Default\tLock pages in memory",
        "L392: 892\tfontdrvhost.ex\t4\tSeLockMemoryPrivilege\t\tLock pages in memory",
        "L427: 900\tfontdrvhost.ex\t4\tSeLockMemoryPrivilege\t\tLock pages in memory",
        "L462: 1004\tsvchost.exe\t4\tSeLockMemoryPrivilege\t\tLock pages in memory",
        "L497: 448\tLogonUI.exe\t4\tSeLockMemoryPrivilege\tDefault\tLock pages in memory",
        "L532: 504\tdwm.exe\t4\tSeLockMemoryPrivilege\t\tLock pages in memory",
        "L567: 544\tsvchost.exe\t4\tSeLockMemoryPrivilege\tPresent,Enabled,Default\tLock pages in memory",
        "L602: 848\tsvchost.exe\t4\tSeLockMemoryPrivilege\t\tLock pages in memory",
        "L637: 996\tsvchost.exe\t4\tSeLockMemoryPrivilege\t\tLock pages in memory",
        "L672: 1048\tsvchost.exe\t4\tSeLockMemoryPrivilege\t\tLock pages in memory",
        "L707: 1056\tsvchost.exe\t4\tSeLockMemoryPrivilege\tPresent,Enabled,Default\tLock pages in memory",
        "L742: 1064\tsvchost.exe\t4\tSeLockMemoryPrivilege\t\tLock pages in memory",
        "L777: 1124\tsvchost.exe\t4\tSeLockMemoryPrivilege\t\tLock pages in memory",
        "L812: 1212\tsvchost.exe\t4\tSeLockMemoryPrivilege\t\tLock pages in memory",
        "L847: 1456\tsvchost.exe\t4\tSeLockMemoryPrivilege\tPresent,Enabled,Default\tLock pages in memory",
        "L882: 1688\tsvchost.exe\t4\tSeLockMemoryPrivilege\t\tLock pages in memory",
        "L917: 436\tvmacthlp.exe\t4\tSeLockMemoryPrivilege\tPresent,Enabled,Default\tLock pages in memory",
        "L952: 1724\tMemCompression\t4\tSeLockMemoryPrivilege\tPresent,Enabled,Default\tLock pages in memory",
        "L987: 2044\tsvchost.exe\t4\tSeLockMemoryPrivilege\t\tLock pages in memory",
        "L1022: 2072\tsvchost.exe\t4\tSeLockMemoryPrivilege\t\tLock pages in memory",
        "L1057: 2092\tsvchost.exe\t4\tSeLockMemoryPrivilege\t\tLock pages in memory",
        "L1092: 2204\tspoolsv.exe\t4\tSeLockMemoryPrivilege\tDefault\tLock pages in memory",
        "L1127: 2332\tsvchost.exe\t4\tSeLockMemoryPrivilege\tDefault\tLock pages in memory",
        "L1162: 2340\tarmsvc.exe\t4\tSeLockMemoryPrivilege\tPresent,Enabled,Default\tLock pages in memory",
        "L1197: 2348\tFireSvc.exe\t4\tSeLockMemoryPrivilege\tPresent,Enabled,Default\tLock pages in memory",
        "L1232: 2376\tHipMgmt.exe\t4\tSeLockMemoryPrivilege\tPresent,Enabled,Default\tLock pages in memory",
        "L1267: 2392\tmacmnsvc.exe\t4\tSeLockMemoryPrivilege\t\tLock pages in memory",
        "L1302: 2408\tmasvc.exe\t4\tSeLockMemoryPrivilege\tPresent,Enabled,Default\tLock pages in memory",
        "L1337: 2436\tmfemms.exe\t4\tSeLockMemoryPrivilege\tPresent,Enabled,Default\tLock pages in memory",
        "L1372: 2444\tVsTskMgr.exe\t4\tSeLockMemoryPrivilege\tPresent,Enabled,Default\tLock pages in memory",
        "L1407: 2580\tSecurityHealth\t4\tSeLockMemoryPrivilege\tDefault\tLock pages in memory",
        "L1442: 2604\tSysmon64.exe\t4\tSeLockMemoryPrivilege\tPresent,Enabled,Default\tLock pages in memory",
        "L1477: 2616\tVelociraptor.e\t4\tSeLockMemoryPrivilege\tPresent,Enabled,Default\tLock pages in memory",
        "L1512: 2648\tVGAuthService.\t4\tSeLockMemoryPrivilege\tPresent,Enabled,Default\tLock pages in memory",
        "L1547: 2656\tvmtoolsd.exe\t4\tSeLockMemoryPrivilege\tPresent,Enabled,Default\tLock pages in memory",
        "L1582: 2684\tManagementAgen\t4\tSeLockMemoryPrivilege\tPresent,Enabled,Default\tLock pages in memory",
        "L1617: 2952\tmfevtps.exe\t4\tSeLockMemoryPrivilege\tPresent,Enabled,Default\tLock pages in memory",